<?xml version="1.0" encoding="UTF-8" ?>
<listado xmlns:xsi="http://www.w3.org/2001/XMLSchema-instance"
         xsi:noNamespaceSchemaLocation="ejercicioTRECE.xsd">
    <afiliado>
        <DNI>385786787</DNI>
        <Nombre>Pepe</Nombre>
        <Apellidos>Domingeuz Arieta</Apellidos>
        <situacion_laboral>en_paro</situacion_laboral>
        <fecha_nacimiento>
            <dia>12</dia>
            <mes>2</mes>
            <año>1988</año>
        </fecha_nacimiento>
        <listado_bajas></listado_bajas>
        <listado_prestaciones>
            <prestacion>
                <cantidad>1564.34</cantidad>
                <inicio>
                    <dia>01</dia>
                    <mes>01</mes>
                    <año>1999</año>
                </inicio>
                <final>
                    <dia>05</dia>
                    <mes>07</mes>
                    <año>2008</año>
                </final>
            </prestacion>
        </listado_prestaciones>
    </afiliado>
    <afiliado>
        <DNI>X35490957</DNI>
        <Nombre>Mohamed</Nombre>
        <Apellidos>Avdol</Apellidos>
        <situacion_laboral>en_paro</situacion_laboral>
        <fecha_nacimiento>
            <dia>12</dia>
            <mes>2</mes>
            <año>1988</año>
        </fecha_nacimiento>
        <listado_bajas>
            <baja>
                <causa>amigdalitis</causa>
                <fecha_inicio>
                    <dia>01</dia>
                    <mes>01</mes>
                    <año>2003</año>
                </fecha_inicio>
                <fecha_final>
                    <dia>15</dia>
                    <mes>12</mes>
                    <año>2022</año>
                </fecha_final>
            </baja>
        </listado_bajas>
        <listado_prestaciones></listado_prestaciones>
    </afiliado>
</listado>